Source_Name,Original_Headline,Translated_Headline,Polarity,Scrape_Date
BBC Spanish,Escasez y altos precios: cómo Ucrania ha convertido los ataques contra plantas petroleras rusas en una de sus principales tácticas de guerra,Shortage and high prices: how Ukraine has converted attacks against Russian oil plants into one of its main war tactics,0.1088888888888888,2025_10_08
BBC Spanish,"""Carteles gringos"": las pandillas que venden en EE.UU. la droga producida en América Latina (y por qué no tienen capos como ""El Chapo"")","""Gringos"": the gangs sold in the US",0.0,2025_10_08
BBC Spanish,La migración negativa que registra Israel por las familias que dejan el país tras la guerra desatada el 7 de octubre,The negative migration recorded by Israel by the families that leave the country after the war unleashed on October 7,-0.3,2025_10_08
BBC Spanish,"El insólito concierto con el que Milei buscó ""recuperar la mística"" en medio de los escándalos de corrupción y la crisis económica en Argentina","The unusual concert with which Milei sought to ""recover mystique"" in the midst of corruption scandals and the economic crisis in Argentina",0.2,2025_10_08
BBC Spanish,"Los 3 científicos que ganaron el Nobel de Física 2025 por hacer que ""las extrañas propiedades del mundo cuántico"" funcionen en un chip","The 3 scientists who won the Nobel of Physics 2025 for making ""the strange properties of the quantum world"" work in a chip",-0.05,2025_10_08
BBC Hindi,"तालिबान के विदेश मंत्री आठ दिन के लिए क्यों आ रहे भारत, अफ़ग़ानिस्तान के मीडिया में ऐसी चर्चा","Why the Foreign Minister of Taliban is coming to India for eight days, such discussion in Afghanistan's media",-0.0625,2025_10_08
BBC Hindi,"'हम अपनी बेटी को दवा समझकर ज़हर पिला रहे थे', मध्य प्रदेश में कफ़ सिरप ने कैसे ली 20 बच्चों की जान","'We were drinking poison as our daughter as medicine', how did Kapha syrup take the life of 20 children in Madhya Pradesh",0.0,2025_10_08
BBC Hindi,"लाइव,म्यांमार में बौद्ध उत्सव के दौरान पैराग्लाइडर से बम हमला, 24 लोगों की मौत","Live, Paraglider bomb attack during Buddhist festival in Myanmar, 24 people killed",-0.0318181818181818,2025_10_08
BBC Hindi,"ट्रंप के ग़ज़ा प्लान पर इसराइली मीडिया की प्रतिक्रिया, 'ट्रंप जो कहेंगे उसे नेतन्याहू को मानना ही पड़ेगा'","Israeli media reacts to Trump's Gaza plan, 'Netanyahu will have to accept whatever Trump says'",0.0,2025_10_08
BBC Hindi,मैथ्स को देखते ही कुछ लोग क्यों कहते हैं 'हमसे ना हो पाएगा',Why do some people say 'we can't do it' as soon as they see maths?,0.0,2025_10_08
BBC Hindi,"हिमाचल प्रदेश: बिलासपुर में लैंडस्लाइड की चपेट में बस, 15 लोगों की मौत","Himachal Pradesh: Bus hit by landslide in Bilaspur, 15 people died",0.0,2025_10_08
BBC Hindi,वो रात जब अमेरिकी पायलट बने ईरान के खिलाफ़ इसराइल की ढाल,That night when Israel's shield against Iran became an American pilot,0.0,2025_10_08
BBC Hindi,कफ़ सिरप लेते समय किन बातों का ध्यान रखना है ज़रूरी,What is important to take care of while taking phlegm syrup,0.4,2025_10_08
BBC Hindi,बिहार चुनाव: नीतीश कुमार कमज़ोर पड़े तो बीजेपी के लिए कितना बड़ा झटका,"Bihar Elections: If Nitish Kumar becomes weak, what a big blow it will be for BJP.",-0.1875,2025_10_08
BBC Portuguese,"Tarifas, juros e demissões: Suprema Corte dos EUA vai redefinir poderes de Trump","Tariffs, interest and layoffs: US Supreme Court will redefine Trump's powers",0.0,2025_10_08
BBC Portuguese,"Carro de Daniel Noboa, presidente do Equador, é atacado; o que se sabe","Car of Daniel Noboa, president of Ecuador, is attacked; what is known",0.0,2025_10_08
BBC Portuguese,Alpinistas são resgatados após ficarem presos em nevasca no Everest,Climbers rescued after being trapped in blizzard on Everest,-0.2,2025_10_08
BBC Portuguese,Renováveis ultrapassam carvão e se tornam maior fonte de energia elétrica pela 1ª vez na história,Renewables exceed charcoal and become a greater source of electricity for the first time in history,0.375,2025_10_08
BBC Portuguese,O trabalho sobre computadores quânticos que deu Prêmio Nobel de Física a pesquisadores,The work on quantum computers that gave researchers the Nobel Prize in Physics,0.0,2025_10_08
BBC Portuguese,"Após dois anos de guerra e destruição, Israel e Hamas estão mais próximos do fim do conflito?","After two years of war and destruction, are Israel and Hamas closer to the end of the conflict?",0.0,2025_10_08
BBC Portuguese,"Vídeo,Metanol: BBC investiga venda de lacres falsos e garrafas de bebidas alcoólicas no Facebook, Duration 2,59","Video, Methanol: BBC investigates sales of fake seals and bottles of alcohol on Facebook, Duration 2.59",-0.5,2025_10_08
BBC Portuguese,Por que uma família se mudou para Israel e outra deixou o país após os ataques de 7 de outubro?,Why has one family moved to Israel and another left the country after October 7 attacks?,0.0,2025_10_08
BBC Portuguese,O deslocamento 'sem precedentes' da população de Gaza em dois anos de guerra,The 'unprecedented' displacement of the Gaza population in two years of war,0.6,2025_10_08
BBC Russian,"«Картина мира разрушается полностью». Как психологи работают с украинскими детьми, вернувшимися из оккупации","""The picture of the world is completely destroyed."" How psychologists work with Ukrainian children who returned from the occupation",0.1,2025_10_08
BBC Russian,"Почему одна семья после 7 октября переехала в Израиль, а другая — покинула страну?","Why did one family move to Israel after October 7, while the other left the country?",-0.0625,2025_10_08
BBC Russian,В Израиле вспоминают жертв нападения ХАМАС 7 октября 2023 года. Фото,"Israel remembers the victims of the Hamas attack on October 7, 2023. Photo",0.0,2025_10_08
BBC Russian,"LIVELive,Война в Украине: власти сообщили об атаках на Днепропетровскую область, есть пострадавшие","Livelive, war in Ukraine: the authorities reported attacks on the Dnipropetrovsk region, there are victims",0.0,2025_10_08
BBC Russian,"Нобеля по физике получили ученые, открывшие макроскопическое квантово-механическое туннелирование",Scientists who discovered macroscopic quantum mechanical tunneling received a Nobel in physics,0.0,2025_10_08
BBC Russian,Нападение с ножом на бургомистра в Германии: полиция не видит политического мотива,A attack with a knife on a burgomaster in Germany: the police do not see a political motive,0.0,2025_10_08
BBC Russian,Предварительные итоги выборов в Сирии: в новый парламент прошли несколько женщин,Preliminary election results in Syria: several women entered the new parliament,0.0681818181818181,2025_10_08
BBC Russian,"ВОЗ встревожена числом курящих электронные сигареты, в том числе детей","WHO is alarmed by the number of people smoking e-cigarettes, including children",0.0,2025_10_08
BBC Russian,Израиль и ХАМАС начали переговоры. В чем главные проблемы мирного плана Трампа?,Israel and Hamas began negotiations. What are the main problems with Trump's peace plan?,0.1666666666666666,2025_10_08
BBC Russian,Во Франции опять нет премьер-министра. Почему это случилось и что будет дальше,"In France, there is no prime minister again. Why did this happen and what will happen next",0.0,2025_10_08
BBC Japanese,ハマスのイスラエル襲撃から2年……各地で集会、ガザでは攻撃続く　エジプトで交渉2日目,"Two years have passed since Hamas' attack on Israel... rallies everywhere, attacks continue in Gaza; second day of negotiations in Egypt",0.0,2025_10_08
BBC Japanese,「あまりにも多くを失った」　戦争開始から2年の犠牲を見つめるパレスチナ人たち,"""We lost so much"" Palestinians staring at the sacrifices two years after the start of the war",0.2,2025_10_08
BBC Japanese,"ビデオ,【検証】 ガザに残る人質はいま……ハマス襲撃から2年, 所要時間 3,07","Video, [Verification] Hostages remain in Gaza...2 years after Hamas attack, time required 3,07",0.0,2025_10_08
BBC Japanese,ノーベル物理学賞、米国拠点の3教授に　量子コンピューターの基礎技術を発見,Nobel Prize in Physics Discovers Basic Technology of Quantum Computers by Three Professors at the US,0.0,2025_10_08
BBC Japanese,ルコルニュ首相が辞任、就任からわずか26日　フランス政界は新たな混乱に,"Prime Minister Le Cornu resigns, just 26 days after taking office, leading to new turmoil in French politics",0.0681818181818181,2025_10_08
BBC Japanese,ノーベル生理学・医学賞、坂口志文氏ら3人に　免疫反応抑える「制御性T細胞」を発見,"Nobel Prize in Physiology and Medicine, Sakaguchi Shifumi, discovered ""regulatory T cells"" that suppress immune responses",0.0,2025_10_08
BBC Japanese,イスラエル、トゥーンベリ氏ら活動家170人を国外追放　拘束中に不当な扱い受けたと活動家たち,Israel deports 170 activists including Thunberg; activists say they were treated unfairly during detention,-0.5,2025_10_08
BBC Japanese,ロシアのミサイルとドローン、イギリスや日本など外国製の部品を使用とゼレンスキー氏,Zelenskiy says Russian missiles and drones use parts from foreign countries such as Britain and Japan,-0.0416666666666666,2025_10_08
BBC Japanese,20年間亡命の政治家、来年2月の総選挙に向け帰国へ　バングラデシュ,"Politician in exile for 20 years returns to Japan for the general election in February next year, Bangladesh",0.025,2025_10_08
BBC Swahili,Uchaguzi Tanzania 2025: Mambo matatu yanayoutofautisha uchaguzi wa Zanzibar na Tanzania,ELECTION TANZANIA 2025: Three things that distinguish Zanzibar and Tanzania elections,0.0,2025_10_08
BBC Swahili,"Moja kwa moja,Mjumbe maalum wa Marekani, mkwe wa Trump kujiunga na mazungumzo ya amani ya Gaza","Directly, US Special Envoy, Trump's son -in -law to join Gaza's peace talks",0.3571428571428571,2025_10_08
BBC Swahili,Mama Polepole: Nirudishieni mwanangu akiwa hai au amekufa,Mother slowly: Return me to my son alive or dead,-0.1333333333333333,2025_10_08
BBC Swahili,Waridi wa BBC: 'Nina urefu wa cm 85 lakini hilo halinizuii kuishi maisha ya kawaida',BBC Roses: 'I have a height of 85 cm but that doesn't stop me living a normal life',0.15,2025_10_08
BBC Swahili,Tetesi za Soka Ulaya Jumatano: Zirkzee haitaki tena Man Utd,European football rumors on Wednesday: Zirkzee no longer wants Man utd,0.1,2025_10_08
BBC Swahili,Humphrey Polepole anayeripotiwa kutekwa Tanzania ni nani?,Who is Humphrey Slowly reportedly abducted in Tanzania?,-0.3,2025_10_08
BBC Swahili,Mtanzania aliyekuwa Israel: ‘Kupiga ng'ombe kuliniepusha kuuawa na Hamas Oktoba 7’,Israeli Tanzanian: 'Beating cows avoided killing Hamas on October 7',0.0,2025_10_08
BBC Swahili,"Je, mwisho wa vita Gaza wakaribia?",Is the end of the war Gaza near?,0.1,2025_10_08
BBC Swahili,Humphrey Polepole: Familia yathibitisha 'katekwa na wasiojulikana',Humphrey Slowly: Family Confirms 'captured by unknown',-0.2,2025_10_08
BBC Swahili,Kwanini Samia ameshindwa kukamilisha mageuzi kwa namna na kiwango alichoahidi?,Why has Samia failed to complete the reform in the form and level he promised?,-0.2,2025_10_08
