Scrape_Date,Source_Name,Source_URL,Source_Language_Code,Source_Region,Original_Headline,Translated_Headline,Polarity,Sentiment_Label,Entities_Raw
2026_06_26,The Hindu,https://www.thehindu.com,en,South Asia,Ram temple donation row: All eight accused named in FIR arrested,Ram temple donation row: All eight accused named in FIR arrested,0.0,neutral,"[('eight', 'CARDINAL'), ('FIR', 'ORG')]"
2026_06_26,The Hindu,https://www.thehindu.com,en,South Asia,"Nihang-police standoff in Uttarakhand ends after talks, group returns to Himachal","Nihang-police standoff in Uttarakhand ends after talks, group returns to Himachal",0.0,neutral,"[('Uttarakhand', 'GPE'), ('Himachal', 'ORG')]"
2026_06_26,The Hindu,https://www.thehindu.com,en,South Asia,Death toll in Kolkata warehouse collapse rises to 15,Death toll in Kolkata warehouse collapse rises to 15,-1.0,negative,"[('Kolkata', 'GPE'), ('15', 'CARDINAL')]"
2026_06_26,The Hindu,https://www.thehindu.com,en,South Asia,Punjab CM Bhagwant Mann’s fake video controversy | Explained,Punjab CM Bhagwant Mann’s fake video controversy | Explained,0.0,neutral,"[('Explained', 'ORG')]"
2026_06_26,The Hindu,https://www.thehindu.com,en,South Asia,"Venezuela earthquake LIVE: World sends rescuers, aid as Venezuela reels from quakes","Venezuela earthquake LIVE: World sends rescuers, aid as Venezuela reels from quakes",0.0,neutral,"[('Venezuela', 'GPE'), ('Venezuela', 'GPE')]"
2026_06_26,BBC World RSS,https://feeds.bbci.co.uk/news/world/rss.xml,en,Global,Rescuers search rubble for survivors as Venezuela earthquakes kill at least 235,Rescuers search rubble for survivors as Venezuela earthquakes kill at least 235,-1.0,negative,"[('Venezuela', 'GPE'), ('at least 235', 'CARDINAL')]"
2026_06_26,BBC World RSS,https://feeds.bbci.co.uk/news/world/rss.xml,en,Global,Earthquake is devastating blow to Venezuela at time of uncertainty,Earthquake is devastating blow to Venezuela at time of uncertainty,0.0,neutral,"[('Venezuela', 'GPE')]"
2026_06_26,BBC World RSS,https://feeds.bbci.co.uk/news/world/rss.xml,en,Global,People flee as building collapses on Caracas outskirts,People flee as building collapses on Caracas outskirts,0.0,neutral,"[('Caracas', 'GPE')]"
2026_06_26,BBC World RSS,https://feeds.bbci.co.uk/news/world/rss.xml,en,Global,UN pauses Strait of Hormuz evacuation plan after cargo ship attacked,UN pauses Strait of Hormuz evacuation plan after cargo ship attacked,-1.0,negative,"[('UN', 'ORG'), ('Hormuz', 'PERSON')]"
2026_06_26,BBC World RSS,https://feeds.bbci.co.uk/news/world/rss.xml,en,Global,Women alleging rape and sexual assault in France call to abolish statute of limitations,Women alleging rape and sexual assault in France call to abolish statute of limitations,0.0,neutral,"[('France', 'GPE')]"
2026_06_26,BBC World RSS,https://feeds.bbci.co.uk/news/world/rss.xml,en,Global,Supreme Court allows Trump to end protected status for Haitian and Syrian immigrants,Supreme Court allows Trump to end protected status for Haitian and Syrian immigrants,0.0,neutral,"[('Supreme Court', 'ORG'), ('Trump', 'ORG'), ('Haitian', 'NORP'), ('Syrian', 'NORP')]"
2026_06_26,BBC World RSS,https://feeds.bbci.co.uk/news/world/rss.xml,en,Global,"Reflecting Pool liner cut with sharp knife or razor, National Park Service says","Reflecting Pool liner cut with sharp knife or razor, National Park Service says",0.0,neutral,"[('National Park Service', 'ORG')]"
2026_06_26,BBC World RSS,https://feeds.bbci.co.uk/news/world/rss.xml,en,Global,Asia stock markets slide as tech shares slump,Asia stock markets slide as tech shares slump,0.0,neutral,"[('Asia', 'LOC')]"
2026_06_26,BBC World RSS,https://feeds.bbci.co.uk/news/world/rss.xml,en,Global,Housing board votes to freeze New York rents in victory for Mamdani,Housing board votes to freeze New York rents in victory for Mamdani,1.0,positive,"[('New York', 'GPE'), ('Mamdani', 'GPE')]"
2026_06_26,BBC World RSS,https://feeds.bbci.co.uk/news/world/rss.xml,en,Global,Row over alleged theft of donations from India's landmark Ram temple,Row over alleged theft of donations from India's landmark Ram temple,0.0,neutral,"[('India', 'GPE')]"
2026_06_26,NYT World RSS,https://rss.nytimes.com/services/xml/rss/nyt/World.xml,en,Global,Venezuela Live Updates: More Rescuers Join Urgent Search for Quake Survivors,Venezuela Live Updates: More Rescuers Join Urgent Search for Quake Survivors,0.0,neutral,"[('Venezuela Live', 'PERSON')]"
2026_06_26,NYT World RSS,https://rss.nytimes.com/services/xml/rss/nyt/World.xml,en,Global,How Three Months of War Changed the Gulf Forever,How Three Months of War Changed the Gulf Forever,-1.0,negative,"[('Three Months', 'DATE'), ('the Gulf Forever', 'EVENT')]"
2026_06_26,NYT World RSS,https://rss.nytimes.com/services/xml/rss/nyt/World.xml,en,Global,Zelensky Steps Up Threats Against Belarus for Aiding Drone Attacks,Zelensky Steps Up Threats Against Belarus for Aiding Drone Attacks,-1.0,negative,"[('Zelensky Steps', 'PERSON')]"
2026_06_26,NYT World RSS,https://rss.nytimes.com/services/xml/rss/nyt/World.xml,en,Global,"Europe’s Deadly Heat Wave: A Jolt for Climate Action, or Just for A.C.?","Europe’s Deadly Heat Wave: A Jolt for Climate Action, or Just for A.C.?",0.0,neutral,"[('Europe’s Deadly Heat Wave: A Jolt for Climate Action', 'ORG'), ('A.C.', 'GPE')]"
2026_06_26,NYT World RSS,https://rss.nytimes.com/services/xml/rss/nyt/World.xml,en,Global,A $2.5 Billion Whodunit: The Hack That Dented the U.K. Economy,A $2.5 Billion Whodunit: The Hack That Dented the U.K. Economy,0.0,neutral,"[('$2.5 Billion', 'MONEY')]"
2026_06_26,NYT World RSS,https://rss.nytimes.com/services/xml/rss/nyt/World.xml,en,Global,Iran’s Long World Cup Journey Defined by War and Political Tension,Iran’s Long World Cup Journey Defined by War and Political Tension,-1.0,negative,"[('Iran', 'GPE')]"
2026_06_26,NYT World RSS,https://rss.nytimes.com/services/xml/rss/nyt/World.xml,en,Global,Heat Wave Prompts Paris to Suspend Sports Events and Public Drinking,Heat Wave Prompts Paris to Suspend Sports Events and Public Drinking,0.0,neutral,"[('Paris', 'GPE'), ('Suspend Sports Events', 'ORG')]"
2026_06_26,NYT World RSS,https://rss.nytimes.com/services/xml/rss/nyt/World.xml,en,Global,World Cups Fans in Myanmar Boycott Junta-Linked Broadcasts,World Cups Fans in Myanmar Boycott Junta-Linked Broadcasts,0.0,neutral,"[('World Cups Fans', 'ORG'), ('Myanmar', 'GPE'), ('Boycott Junta', 'PERSON')]"
2026_06_26,NYT World RSS,https://rss.nytimes.com/services/xml/rss/nyt/World.xml,en,Global,Deadly Heat Wave in Europe Continues to Smash Temperature Records,Deadly Heat Wave in Europe Continues to Smash Temperature Records,0.0,neutral,"[('Deadly Heat Wave', 'PERSON'), ('Europe Continues', 'LOC')]"
2026_06_26,NYT World RSS,https://rss.nytimes.com/services/xml/rss/nyt/World.xml,en,Global,Can a Youth Boom Survive South Sudan’s Education Crisis?,Can a Youth Boom Survive South Sudan’s Education Crisis?,-1.0,negative,[]
