Scrape_Date,Source_Name,Source_URL,Source_Language_Code,Source_Region,Original_Headline,Translated_Headline,Polarity,Sentiment_Label,Entities_Raw
2026_07_08,The Hindu,https://www.thehindu.com,en,South Asia,The 2008 Ahmedabad serial blasts case and Gujarat High Court verdict | Explained,The 2008 Ahmedabad serial blasts case and Gujarat High Court verdict | Explained,0.0,neutral,"[('2008', 'DATE'), ('Gujarat High Court', 'ORG'), ('Explained', 'ORG')]"
2026_07_08,The Hindu,https://www.thehindu.com,en,South Asia,"A missing girl, mob violence, and an encounter: What happened in West Bengal’s Baruipur?","A missing girl, mob violence, and an encounter: What happened in West Bengal’s Baruipur?",0.0,neutral,"[('West Bengal’s Baruipur', 'GPE')]"
2026_07_08,The Hindu,https://www.thehindu.com,en,South Asia,"Cultural heritage connect us, thank Indonesian people for preserving it: Modi at Prambanan Temple complex","Cultural heritage connect us, thank Indonesian people for preserving it: Modi at Prambanan Temple complex",0.0,neutral,"[('Indonesian', 'NORP'), ('Prambanan Temple', 'FAC')]"
2026_07_08,The Hindu,https://www.thehindu.com,en,South Asia,How India’s life insurance sector funds government expenditure,How India’s life insurance sector funds government expenditure,0.0,neutral,"[('India', 'GPE')]"
2026_07_08,The Hindu,https://www.thehindu.com,en,South Asia,Case against Sena corporator on charges of assaulting doctors in Thane hospital,Case against Sena corporator on charges of assaulting doctors in Thane hospital,0.0,neutral,"[('Thane', 'GPE')]"
2026_07_08,The Hindu,https://www.thehindu.com,en,South Asia,"Wildflower season is here: From Kaas Plateau to Dzukou Valley, where to trek this season","Wildflower season is here: From Kaas Plateau to Dzukou Valley, where to trek this season",0.0,neutral,"[('Kaas Plateau', 'PERSON'), ('Dzukou Valley', 'PERSON')]"
2026_07_08,The Hindu,https://www.thehindu.com,en,South Asia,Grand ambitions: On India’s cooperative sector,Grand ambitions: On India’s cooperative sector,0.0,neutral,"[('India', 'GPE')]"
2026_07_08,The Hindu,https://www.thehindu.com,en,South Asia,Deceptive dispute: On the Taj Mahal,Deceptive dispute: On the Taj Mahal,0.0,neutral,"[('the Taj Mahal', 'ORG')]"
2026_07_08,BBC World RSS,https://feeds.bbci.co.uk/news/world/rss.xml,en,Global,Will Le Pen rise again? French nationalist leader defiant after court's ruling,Will Le Pen rise again? French nationalist leader defiant after court's ruling,0.0,neutral,"[('Will Le', 'PERSON'), ('French', 'NORP')]"
2026_07_08,BBC World RSS,https://feeds.bbci.co.uk/news/world/rss.xml,en,Global,Nato allies announce £37bn for new missile project,Nato allies announce £37bn for new missile project,0.0,neutral,"[('Nato', 'ORG'), ('37bn', 'MONEY')]"
2026_07_08,BBC World RSS,https://feeds.bbci.co.uk/news/world/rss.xml,en,Global,Russian fuel shortages bite – but will Putin change tack in Ukraine war?,Russian fuel shortages bite – but will Putin change tack in Ukraine war?,-1.0,negative,"[('Russian', 'NORP'), ('Putin', 'PERSON'), ('Ukraine', 'GPE')]"
2026_07_08,BBC World RSS,https://feeds.bbci.co.uk/news/world/rss.xml,en,Global,'The water just came so fast': Typhoon triggers floods and rare tornadoes in China,'The water just came so fast': Typhoon triggers floods and rare tornadoes in China,0.0,neutral,"[('Typhoon', 'WORK_OF_ART'), ('China', 'GPE')]"
2026_07_08,BBC World RSS,https://feeds.bbci.co.uk/news/world/rss.xml,en,Global,"Suspect ate Chick-fil-A and interacted with Charlie Kirk staff before shooting, court hears","Suspect ate Chick-fil-A and interacted with Charlie Kirk staff before shooting, court hears",0.0,neutral,"[('Chick', 'GPE'), ('Charlie Kirk', 'PERSON')]"
2026_07_08,BBC World RSS,https://feeds.bbci.co.uk/news/world/rss.xml,en,Global,Trains and emergency calls affected after major outage at Australia's largest telecoms company,Trains and emergency calls affected after major outage at Australia's largest telecoms company,0.0,neutral,"[('Australia', 'GPE')]"
2026_07_08,BBC World RSS,https://feeds.bbci.co.uk/news/world/rss.xml,en,Global,Utah boarding school where Paris Hilton alleged abuse as a teen loses its licence,Utah boarding school where Paris Hilton alleged abuse as a teen loses its licence,0.0,neutral,"[('Utah', 'GPE'), ('Paris Hilton', 'ORG')]"
2026_07_08,BBC World RSS,https://feeds.bbci.co.uk/news/world/rss.xml,en,Global,Australia dock workers call for 28-hour week in AI talks,Australia dock workers call for 28-hour week in AI talks,0.0,neutral,"[('Australia', 'GPE'), ('28-hour', 'TIME'), ('AI', 'GPE')]"
2026_07_08,BBC World RSS,https://feeds.bbci.co.uk/news/world/rss.xml,en,Global,Top Democrats press Maine Senate candidate to drop out of race over sexual assault allegation,Top Democrats press Maine Senate candidate to drop out of race over sexual assault allegation,0.0,neutral,"[('Democrats', 'NORP'), ('Maine Senate', 'ORG')]"
2026_07_08,BBC World RSS,https://feeds.bbci.co.uk/news/world/rss.xml,en,Global,Woman suspected of Monaco bomb attack found dead in Ukraine,Woman suspected of Monaco bomb attack found dead in Ukraine,-1.0,negative,"[('Monaco', 'ORG'), ('Ukraine', 'GPE')]"
2026_07_08,NYT World RSS,https://rss.nytimes.com/services/xml/rss/nyt/World.xml,en,Global,"In NATO’s Next Act, Can Europe Lead?","In NATO’s Next Act, Can Europe Lead?",0.0,neutral,"[('NATO', 'ORG')]"
2026_07_08,NYT World RSS,https://rss.nytimes.com/services/xml/rss/nyt/World.xml,en,Global,"Mass Mournings In Qom, Where Khamenei Ruled Supreme Over Iran’s Clerics","Mass Mournings In Qom, Where Khamenei Ruled Supreme Over Iran’s Clerics",0.0,neutral,"[('Iran', 'GPE')]"
2026_07_08,NYT World RSS,https://rss.nytimes.com/services/xml/rss/nyt/World.xml,en,Global,Farage Resigns and Says He Will Run Again in Special Election,Farage Resigns and Says He Will Run Again in Special Election,0.0,neutral,[]
2026_07_08,NYT World RSS,https://rss.nytimes.com/services/xml/rss/nyt/World.xml,en,Global,Estonia Won the War on Fentanyl. What Came Next Was Even Worse.,Estonia Won the War on Fentanyl. What Came Next Was Even Worse.,-1.0,negative,"[('Estonia Won the War on', 'ORG'), ('Fentanyl', 'PERSON')]"
2026_07_08,NYT World RSS,https://rss.nytimes.com/services/xml/rss/nyt/World.xml,en,Global,Le Pen Says She Will Run for Presidency After Court Lifts Ban,Le Pen Says She Will Run for Presidency After Court Lifts Ban,0.0,neutral,"[('Court', 'ORG')]"
2026_07_08,NYT World RSS,https://rss.nytimes.com/services/xml/rss/nyt/World.xml,en,Global,Venezuelans Criticize Own Government Response After Twin Earthquakes,Venezuelans Criticize Own Government Response After Twin Earthquakes,1.0,positive,"[('Venezuelans Criticize Own Government Response', 'ORG')]"
2026_07_08,NYT World RSS,https://rss.nytimes.com/services/xml/rss/nyt/World.xml,en,Global,Suspect in Monaco Bombing Attack Is Found Dead in Ukraine,Suspect in Monaco Bombing Attack Is Found Dead in Ukraine,-1.0,negative,"[('Monaco Bombing Attack Is Found Dead', 'FAC'), ('Ukraine', 'GPE')]"
2026_07_08,NYT World RSS,https://rss.nytimes.com/services/xml/rss/nyt/World.xml,en,Global,A Supreme Leader’s Final Crowds,A Supreme Leader’s Final Crowds,0.0,neutral,[]
2026_07_08,NYT World RSS,https://rss.nytimes.com/services/xml/rss/nyt/World.xml,en,Global,Prince Harry Loses Privacy Lawsuit Against Daily Mail Publisher,Prince Harry Loses Privacy Lawsuit Against Daily Mail Publisher,0.0,neutral,"[('Prince Harry Loses Privacy Lawsuit Against Daily Mail', 'ORG')]"
2026_07_08,NYT World RSS,https://rss.nytimes.com/services/xml/rss/nyt/World.xml,en,Global,How a Four-Generation Cuban Family Survives on $60 a Month,How a Four-Generation Cuban Family Survives on $60 a Month,0.0,neutral,"[('60', 'MONEY')]"
