Scrape_Date,Source_Name,Source_URL,Source_Language_Code,Source_Region,Original_Headline,Translated_Headline,Polarity,Sentiment_Label,Entities_Raw
2026_07_11,The Hindu,https://www.thehindu.com,en,South Asia,Death of 14 Juang girls from Odisha in TN ammonia gas leak exposes tribe’s socio-economic struggle,Death of 14 Juang girls from Odisha in TN ammonia gas leak exposes tribe’s socio-economic struggle,-1.0,negative,"[('14', 'CARDINAL'), ('Odisha', 'GPE'), ('TN', 'GPE')]"
2026_07_11,The Hindu,https://www.thehindu.com,en,South Asia,Balcony design trends: How outdoor spaces are becoming extensions of home,Balcony design trends: How outdoor spaces are becoming extensions of home,0.0,neutral,[]
2026_07_11,The Hindu,https://www.thehindu.com,en,South Asia,"'India-NZ Waka' ready to embark on new voyage together, says Modi at diaspora event | LIVE","'India-NZ Waka' ready to embark on new voyage together, says Modi at diaspora event | LIVE",0.0,neutral,"[('India', 'GPE'), ('Modi', 'PERSON')]"
2026_07_11,The Hindu,https://www.thehindu.com,en,South Asia,"UN Special Rapporteurs raise concerns over SIR, use of AI-driven models for exclusion of minorities","UN Special Rapporteurs raise concerns over SIR, use of AI-driven models for exclusion of minorities",0.0,neutral,"[('UN Special Rapporteurs', 'ORG'), ('SIR', 'ORG'), ('AI', 'GPE')]"
2026_07_11,The Hindu,https://www.thehindu.com,en,South Asia,A future of financial health for every Indian,A future of financial health for every Indian,0.0,neutral,"[('Indian', 'NORP')]"
2026_07_11,The Hindu,https://www.thehindu.com,en,South Asia,"Born in Sri Lanka, brought up in India, residing in the US: IT employee faces threat of being declared ‘stateless’","Born in Sri Lanka, brought up in India, residing in the US: IT employee faces threat of being declared ‘stateless’",0.0,neutral,"[('Sri Lanka', 'GPE'), ('India', 'GPE'), ('US', 'GPE')]"
2026_07_11,The Hindu,https://www.thehindu.com,en,South Asia,"Datia byelection: Narottam Mishra's supporters clash with M.P. Police, block highway after BJP ticket snub","Datia byelection: Narottam Mishra's supporters clash with M.P. Police, block highway after BJP ticket snub",0.0,neutral,"[(""Narottam Mishra's"", 'PERSON'), ('M.P. Police', 'ORG'), ('BJP', 'ORG')]"
2026_07_11,BBC World RSS,https://feeds.bbci.co.uk/news/world/rss.xml,en,Global,US wants Iran to pledge to stop shooting at ships in Strait of Hormuz,US wants Iran to pledge to stop shooting at ships in Strait of Hormuz,0.0,neutral,"[('US', 'GPE'), ('Iran', 'GPE'), ('Strait', 'LOC')]"
2026_07_11,BBC World RSS,https://feeds.bbci.co.uk/news/world/rss.xml,en,Global,Spain battles to contain one of its deadliest wildfires as at least 12 killed,Spain battles to contain one of its deadliest wildfires as at least 12 killed,-1.0,negative,"[('Spain', 'GPE'), ('one', 'CARDINAL'), ('at least 12', 'CARDINAL')]"
2026_07_11,BBC World RSS,https://feeds.bbci.co.uk/news/world/rss.xml,en,Global,Meet the crypto billionaires building a world where money buys you a vote,Meet the crypto billionaires building a world where money buys you a vote,0.0,neutral,[]
2026_07_11,BBC World RSS,https://feeds.bbci.co.uk/news/world/rss.xml,en,Global,East Asia braces for destructive typhoon as landslides kill 15 in Philippines,East Asia braces for destructive typhoon as landslides kill 15 in Philippines,-1.0,negative,"[('East Asia', 'LOC'), ('15', 'CARDINAL'), ('Philippines', 'GPE')]"
2026_07_11,BBC World RSS,https://feeds.bbci.co.uk/news/world/rss.xml,en,Global,The photo that shows who's really on top in Le Pen's party,The photo that shows who's really on top in Le Pen's party,0.0,neutral,"[(""Le Pen's"", 'FAC')]"
2026_07_11,BBC World RSS,https://feeds.bbci.co.uk/news/world/rss.xml,en,Global,"Apple sues OpenAI, its employees claiming theft of trade secrets","Apple sues OpenAI, its employees claiming theft of trade secrets",0.0,neutral,"[('Apple', 'ORG'), ('OpenAI', 'GPE')]"
2026_07_11,BBC World RSS,https://feeds.bbci.co.uk/news/world/rss.xml,en,Global,New dinosaur species as long as cricket pitch discovered in Thailand,New dinosaur species as long as cricket pitch discovered in Thailand,0.0,neutral,"[('Thailand', 'GPE')]"
2026_07_11,BBC World RSS,https://feeds.bbci.co.uk/news/world/rss.xml,en,Global,"Russia trains sights on schools, offices and buses in busy Ukrainian city","Russia trains sights on schools, offices and buses in busy Ukrainian city",0.0,neutral,"[('Russia', 'GPE'), ('Ukrainian', 'GPE')]"
2026_07_11,BBC World RSS,https://feeds.bbci.co.uk/news/world/rss.xml,en,Global,Meta pulls new AI image feature after days of backlash,Meta pulls new AI image feature after days of backlash,0.0,neutral,"[('Meta', 'ORG'), ('AI', 'GPE'), ('days', 'DATE')]"
2026_07_11,BBC World RSS,https://feeds.bbci.co.uk/news/world/rss.xml,en,Global,Small plane crash in Bahamas kills 10 people,Small plane crash in Bahamas kills 10 people,-1.0,negative,"[('Bahamas', 'GPE'), ('10', 'CARDINAL')]"
2026_07_11,NYT World RSS,https://rss.nytimes.com/services/xml/rss/nyt/World.xml,en,Global,Israel Struck an Iranian Steel Facility. Was It a Valid Military Target?,Israel Struck an Iranian Steel Facility. Was It a Valid Military Target?,0.0,neutral,"[('Israel Struck', 'PERSON'), ('an Iranian Steel Facility', 'ORG')]"
2026_07_11,NYT World RSS,https://rss.nytimes.com/services/xml/rss/nyt/World.xml,en,Global,Man Arrested in Killing of U.K. Ex-Lawmaker Is Released,Man Arrested in Killing of U.K. Ex-Lawmaker Is Released,-1.0,negative,"[('Killing', 'GPE'), ('U.K. Ex-Lawmaker Is Released', 'ORG')]"
2026_07_11,NYT World RSS,https://rss.nytimes.com/services/xml/rss/nyt/World.xml,en,Global,"England and Norway, Old Friends, Resurrect a Rivalry for the World Cup","England and Norway, Old Friends, Resurrect a Rivalry for the World Cup",0.0,neutral,"[('England', 'GPE'), ('Norway', 'GPE'), ('Old Friends', 'ORG'), ('the World Cup', 'EVENT')]"
2026_07_11,NYT World RSS,https://rss.nytimes.com/services/xml/rss/nyt/World.xml,en,Global,‘They Don’t Need People’: The Workers Left Behind by China’s Robot Drive,‘They Don’t Need People’: The Workers Left Behind by China’s Robot Drive,0.0,neutral,"[('China', 'GPE')]"
2026_07_11,NYT World RSS,https://rss.nytimes.com/services/xml/rss/nyt/World.xml,en,Global,U.S. Citizen Tests Positive for Ebola in Democratic Republic of Congo,U.S. Citizen Tests Positive for Ebola in Democratic Republic of Congo,0.0,neutral,"[('U.S.', 'GPE'), ('Democratic Republic of Congo', 'GPE')]"
2026_07_11,NYT World RSS,https://rss.nytimes.com/services/xml/rss/nyt/World.xml,en,Global,"After Being Delayed by Trump, a Canada-U.S. Bridge is Set to Open","After Being Delayed by Trump, a Canada-U.S. Bridge is Set to Open",0.0,neutral,"[('Trump', 'ORG'), ('Canada', 'GPE')]"
2026_07_11,NYT World RSS,https://rss.nytimes.com/services/xml/rss/nyt/World.xml,en,Global,"Iran’s Supreme Leader Remains Absent, a Void at the Top of the Regime","Iran’s Supreme Leader Remains Absent, a Void at the Top of the Regime",0.0,neutral,"[('Iran', 'GPE'), ('Remains Absent', 'PERSON')]"
2026_07_11,NYT World RSS,https://rss.nytimes.com/services/xml/rss/nyt/World.xml,en,Global,At Least 12 People Die in Southern Spain Wildfire,At Least 12 People Die in Southern Spain Wildfire,0.0,neutral,"[('At Least 12', 'CARDINAL')]"
2026_07_11,NYT World RSS,https://rss.nytimes.com/services/xml/rss/nyt/World.xml,en,Global,"After Venezuela Earthquakes, a Youth Baseball League Counts the Dead","After Venezuela Earthquakes, a Youth Baseball League Counts the Dead",0.0,neutral,"[('Venezuela Earthquakes', 'PERSON'), ('Youth Baseball League Counts the Dead', 'ORG')]"
2026_07_11,NYT World RSS,https://rss.nytimes.com/services/xml/rss/nyt/World.xml,en,Global,Moscow Still Has Art and Culture. Just Don’t Say ‘Ukraine.’,Moscow Still Has Art and Culture. Just Don’t Say ‘Ukraine.’,0.0,neutral,"[('Moscow', 'GPE'), ('Ukraine', 'GPE')]"
