Scrape_Date,Source_Name,Source_URL,Source_Language_Code,Source_Region,Original_Headline,Translated_Headline,Polarity,Sentiment_Label,Entities_Raw
2026_06_23,The Hindu,https://www.thehindu.com,en,South Asia,IT Ministry asks CJP’s Dipke to be present for hearing on X account ban,IT Ministry asks CJP’s Dipke to be present for hearing on X account ban,0.0,neutral,"[('IT Ministry', 'ORG'), ('CJP', 'ORG')]"
2026_06_23,The Hindu,https://www.thehindu.com,en,South Asia,George Kurian resigns as Union Minister after his Rajya Sabha term ends,George Kurian resigns as Union Minister after his Rajya Sabha term ends,0.0,neutral,"[('George Kurian', 'PERSON'), ('Rajya Sabha', 'ORG')]"
2026_06_23,The Hindu,https://www.thehindu.com,en,South Asia,Devastating building fire in Lucknow puts development authority’s actions under scrutiny,Devastating building fire in Lucknow puts development authority’s actions under scrutiny,0.0,neutral,"[('Lucknow', 'GPE')]"
2026_06_23,The Hindu,https://www.thehindu.com,en,South Asia,Two workers killed in susppected boiler blast at factory near Visakhapatnam’s Pharma City,Two workers killed in susppected boiler blast at factory near Visakhapatnam’s Pharma City,-1.0,negative,"[('Two', 'CARDINAL'), ('Visakhapatnam', 'GPE'), ('Pharma City', 'GPE')]"
2026_06_23,The Hindu,https://www.thehindu.com,en,South Asia,"Google restores Telegram on Play Store in India, app starts functioning for some users","Google restores Telegram on Play Store in India, app starts functioning for some users",0.0,neutral,"[('Google', 'ORG'), ('Telegram', 'PRODUCT'), ('Play Store', 'WORK_OF_ART'), ('India', 'GPE')]"
2026_06_23,The Hindu,https://www.thehindu.com,en,South Asia,"West Asia war LIVE updates: Iran will determine usage of unfrozen assets, says Iranian Ambassador","West Asia war LIVE updates: Iran will determine usage of unfrozen assets, says Iranian Ambassador",-1.0,negative,"[('West Asia war', 'LOC'), ('Iran', 'GPE'), ('Iranian', 'NORP')]"
2026_06_23,BBC World RSS,https://feeds.bbci.co.uk/news/world/rss.xml,en,Global,Iran says no new commitments on nuclear sites after Vance says inspectors to be invited back,Iran says no new commitments on nuclear sites after Vance says inspectors to be invited back,0.0,neutral,"[('Iran', 'GPE'), ('Vance', 'PERSON')]"
2026_06_23,BBC World RSS,https://feeds.bbci.co.uk/news/world/rss.xml,en,Global,Trump anticipates better relationship with Colombia under new leader,Trump anticipates better relationship with Colombia under new leader,0.0,neutral,"[('Colombia', 'GPE')]"
2026_06_23,BBC World RSS,https://feeds.bbci.co.uk/news/world/rss.xml,en,Global,Ransom note claims Nancy Guthrie died after abduction,Ransom note claims Nancy Guthrie died after abduction,0.0,neutral,"[('Ransom', 'PERSON'), ('Nancy Guthrie', 'PERSON')]"
2026_06_23,BBC World RSS,https://feeds.bbci.co.uk/news/world/rss.xml,en,Global,"Montreal shooting leaves officer, civilian and suspect dead","Montreal shooting leaves officer, civilian and suspect dead",0.0,neutral,"[('Montreal', 'GPE')]"
2026_06_23,BBC World RSS,https://feeds.bbci.co.uk/news/world/rss.xml,en,Global,Inquiry ordered after building fire kills 15 in north India city,Inquiry ordered after building fire kills 15 in north India city,-1.0,negative,"[('15', 'CARDINAL'), ('India', 'GPE')]"
2026_06_23,BBC World RSS,https://feeds.bbci.co.uk/news/world/rss.xml,en,Global,Dettol apologises after ad to clean up 'toxic men' backfires in China,Dettol apologises after ad to clean up 'toxic men' backfires in China,0.0,neutral,"[('Dettol', 'ORG'), ('China', 'GPE')]"
2026_06_23,BBC World RSS,https://feeds.bbci.co.uk/news/world/rss.xml,en,Global,"Myanmar army killed over 700 civilians in six months, UN says","Myanmar army killed over 700 civilians in six months, UN says",-1.0,negative,"[('Myanmar', 'GPE'), ('700', 'CARDINAL'), ('six months', 'DATE'), ('UN', 'ORG')]"
2026_06_23,BBC World RSS,https://feeds.bbci.co.uk/news/world/rss.xml,en,Global,Russian troop build-up threatens city seen as key to seizing Ukraine's Donbas,Russian troop build-up threatens city seen as key to seizing Ukraine's Donbas,0.0,neutral,"[('Russian', 'NORP'), ('Ukraine', 'GPE'), ('Donbas', 'GPE')]"
2026_06_23,BBC World RSS,https://feeds.bbci.co.uk/news/world/rss.xml,en,Global,Tesla crash that killed a woman under US federal investigation,Tesla crash that killed a woman under US federal investigation,-1.0,negative,"[('US', 'GPE')]"
2026_06_23,BBC World RSS,https://feeds.bbci.co.uk/news/world/rss.xml,en,Global,At least 13 killed and dozens injured after Qatar gas explosion,At least 13 killed and dozens injured after Qatar gas explosion,-1.0,negative,"[('At least 13', 'CARDINAL'), ('dozens', 'CARDINAL'), ('Qatar', 'GPE')]"
2026_06_23,NYT World RSS,https://rss.nytimes.com/services/xml/rss/nyt/World.xml,en,Global,How Mark Rutte of NATO Manages an Unpredictable Trump,How Mark Rutte of NATO Manages an Unpredictable Trump,0.0,neutral,"[('Mark Rutte', 'PERSON'), ('NATO', 'ORG')]"
2026_06_23,NYT World RSS,https://rss.nytimes.com/services/xml/rss/nyt/World.xml,en,Global,‘A Terrible Inheritance’: Could Andy Burnham Succeed Where Starmer Failed?,‘A Terrible Inheritance’: Could Andy Burnham Succeed Where Starmer Failed?,-1.0,negative,"[('Andy Burnham Succeed', 'PERSON')]"
2026_06_23,NYT World RSS,https://rss.nytimes.com/services/xml/rss/nyt/World.xml,en,Global,Iran Makes Moves to Assert Control Over the Strait of Hormuz,Iran Makes Moves to Assert Control Over the Strait of Hormuz,0.0,neutral,"[('Iran', 'GPE'), ('the Strait of Hormuz', 'LOC')]"
2026_06_23,NYT World RSS,https://rss.nytimes.com/services/xml/rss/nyt/World.xml,en,Global,"Soldier, Scholar and Symbol: Marc Bloch Is Elevated to France’s Panthéon","Soldier, Scholar and Symbol: Marc Bloch Is Elevated to France’s Panthéon",0.0,neutral,"[('Scholar', 'ORG'), ('Marc Bloch', 'PERSON'), ('France', 'GPE')]"
2026_06_23,NYT World RSS,https://rss.nytimes.com/services/xml/rss/nyt/World.xml,en,Global,Those British Strawberries Are Being Picked by Central Asian Workers,Those British Strawberries Are Being Picked by Central Asian Workers,0.0,neutral,"[('Those British Strawberries Are Being Picked', 'ORG'), ('Central Asian Workers', 'ORG')]"
2026_06_23,NYT World RSS,https://rss.nytimes.com/services/xml/rss/nyt/World.xml,en,Global,"Delcy Rodríguez, Venezuela’s President, Struggles to Uphold Trump’s Narrative of Success","Delcy Rodríguez, Venezuela’s President, Struggles to Uphold Trump’s Narrative of Success",1.0,positive,"[('Delcy Rodríguez', 'PERSON'), ('Venezuela', 'GPE'), ('Uphold Trump’s Narrative of Success', 'ORG')]"
2026_06_23,NYT World RSS,https://rss.nytimes.com/services/xml/rss/nyt/World.xml,en,Global,Iranian Singer Sentenced to 74 Lashes for Performing Without Hijab,Iranian Singer Sentenced to 74 Lashes for Performing Without Hijab,0.0,neutral,"[('Iranian', 'NORP'), ('74', 'CARDINAL')]"
2026_06_23,NYT World RSS,https://rss.nytimes.com/services/xml/rss/nyt/World.xml,en,Global,"At World Cup Soccer Game, Palestinian Emblems Abound","At World Cup Soccer Game, Palestinian Emblems Abound",0.0,neutral,"[('World Cup Soccer Game', 'EVENT'), ('Palestinian', 'NORP')]"
2026_06_23,NYT World RSS,https://rss.nytimes.com/services/xml/rss/nyt/World.xml,en,Global,Keir Starmer Resigns as UK Prime Minister,Keir Starmer Resigns as UK Prime Minister,0.0,neutral,"[('Keir Starmer Resigns', 'ORG'), ('UK', 'GPE')]"
2026_06_23,NYT World RSS,https://rss.nytimes.com/services/xml/rss/nyt/World.xml,en,Global,Cuba’s Fuel Crisis Brings Schools to a Standstill,Cuba’s Fuel Crisis Brings Schools to a Standstill,-1.0,negative,"[('Cuba', 'GPE')]"
